{
  "schema": "floodsaathi.relay.v1",
  "region": "punjab",
  "generated_at": "2026-10-30T15:55:57.075446+05:30",
  "sources": {
    "sachet": {
      "ok": true,
      "fetched_at": "2026-10-30T15:55:48.731886+05:30",
      "age_min": 0
    },
    "openmeteo": {
      "ok": true,
      "fetched_at": "2026-10-30T15:55:49.019930+05:30",
      "age_min": 0
    },
    "cwc": {
      "ok": true,
      "fetched_at": "2026-10-30T15:55:54.460556+05:30",
      "age_min": 0
    }
  },
  "gauges": [
    {
      "id": "G_HARIKE",
      "name": "Harike Barrage",
      "river": "Sutlej-Beas",
      "lat": 31.15,
      "lon": 74.95,
      "level_m": 3.58,
      "warning_m": 3.8,
      "danger_m": 4.5,
      "bank_m": 4.2,
      "trend_m_per_h": 0.02,
      "observed_at": "2026-10-30T15:55:54.460556+05:30",
      "upstream_id": "G_RSD",
      "downstream_id": null,
      "regulated": true
    },
    {
      "id": "G_KOLDAM",
      "name": "Kol Dam",
      "river": "Sutlej",
      "lat": 31.3824,
      "lon": 76.87199,
      "level_m": 721.02,
      "warning_m": 722.22,
      "danger_m": 724.22,
      "bank_m": 725.72,
      "trend_m_per_h": 0.0,
      "observed_at": "2026-10-30T15:55:54.460556+05:30",
      "upstream_id": null,
      "downstream_id": "G_HARIKE",
      "regulated": true
    },
    {
      "id": "G_RSD",
      "name": "Ranjit Sagar Dam (Thein Dam)",
      "river": "Ravi",
      "lat": 32.444,
      "lon": 75.734,
      "level_m": 522.51,
      "warning_m": 525.91,
      "danger_m": 527.91,
      "bank_m": 528.91,
      "trend_m_per_h": 0.01,
      "observed_at": "2026-10-30T15:55:54.460556+05:30",
      "upstream_id": null,
      "downstream_id": "G_HARIKE",
      "regulated": true
    }
  ],
  "reach_speeds": [
    {
      "from": "G_RSD",
      "to": "G_HARIKE",
      "km": 165.0,
      "p25": 1.8,
      "median": 2.8,
      "p75": 4.2,
      "n_events": 12,
      "basis": "history"
    },
    {
      "from": "G_KOLDAM",
      "to": "G_HARIKE",
      "km": 210.0,
      "p25": 2.0,
      "median": 3.2,
      "p75": 4.8,
      "n_events": 18,
      "basis": "history"
    }
  ],
  "rain_by_district": [
    {
      "district": "Amritsar",
      "lat": 31.634,
      "lon": 74.872,
      "mm_72h": 0.0,
      "hourly_mm": [
        0.0,
        0.0,
        0.0,
        0.0,
        0.0,
        0.0,
        0.0,
        0.0,
        0.0,
        0.0,
        0.0,
        0.0,
        0.0,
        0.0,
        0.0,
        0.0,
        0.0,
        0.0,
        0.0,
        0.0,
        0.0,
        0.0,
        0.0,
        0.0,
        0.0,
        0.0,
        0.0,
        0.0,
        0.0,
        0.0,
        0.0,
        0.0,
        0.0,
        0.0,
        0.0,
        0.0,
        0.0,
        0.0,
        0.0,
        0.0,
        0.0,
        0.0,
        0.0,
        0.0,
        0.0,
        0.0,
        0.0,
        0.0,
        0.0,
        0.0,
        0.0,
        0.0,
        0.0,
        0.0,
        0.0,
        0.0,
        0.0,
        0.0,
        0.0,
        0.0,
        0.0,
        0.0,
        0.0,
        0.0,
        0.0,
        0.0,
        0.0,
        0.0,
        0.0,
        0.0,
        0.0,
        0.0
      ]
    },
    {
      "district": "Ludhiana",
      "lat": 30.901,
      "lon": 75.857,
      "mm_72h": 0.0,
      "hourly_mm": [
        0.0,
        0.0,
        0.0,
        0.0,
        0.0,
        0.0,
        0.0,
        0.0,
        0.0,
        0.0,
        0.0,
        0.0,
        0.0,
        0.0,
        0.0,
        0.0,
        0.0,
        0.0,
        0.0,
        0.0,
        0.0,
        0.0,
        0.0,
        0.0,
        0.0,
        0.0,
        0.0,
        0.0,
        0.0,
        0.0,
        0.0,
        0.0,
        0.0,
        0.0,
        0.0,
        0.0,
        0.0,
        0.0,
        0.0,
        0.0,
        0.0,
        0.0,
        0.0,
        0.0,
        0.0,
        0.0,
        0.0,
        0.0,
        0.0,
        0.0,
        0.0,
        0.0,
        0.0,
        0.0,
        0.0,
        0.0,
        0.0,
        0.0,
        0.0,
        0.0,
        0.0,
        0.0,
        0.0,
        0.0,
        0.0,
        0.0,
        0.0,
        0.0,
        0.0,
        0.0,
        0.0,
        0.0
      ]
    },
    {
      "district": "Jalandhar",
      "lat": 31.326,
      "lon": 75.576,
      "mm_72h": 0.0,
      "hourly_mm": [
        0.0,
        0.0,
        0.0,
        0.0,
        0.0,
        0.0,
        0.0,
        0.0,
        0.0,
        0.0,
        0.0,
        0.0,
        0.0,
        0.0,
        0.0,
        0.0,
        0.0,
        0.0,
        0.0,
        0.0,
        0.0,
        0.0,
        0.0,
        0.0,
        0.0,
        0.0,
        0.0,
        0.0,
        0.0,
        0.0,
        0.0,
        0.0,
        0.0,
        0.0,
        0.0,
        0.0,
        0.0,
        0.0,
        0.0,
        0.0,
        0.0,
        0.0,
        0.0,
        0.0,
        0.0,
        0.0,
        0.0,
        0.0,
        0.0,
        0.0,
        0.0,
        0.0,
        0.0,
        0.0,
        0.0,
        0.0,
        0.0,
        0.0,
        0.0,
        0.0,
        0.0,
        0.0,
        0.0,
        0.0,
        0.0,
        0.0,
        0.0,
        0.0,
        0.0,
        0.0,
        0.0,
        0.0
      ]
    },
    {
      "district": "Patiala",
      "lat": 30.34,
      "lon": 76.387,
      "mm_72h": 0.3,
      "hourly_mm": [
        0.0,
        0.0,
        0.2,
        0.1,
        0.0,
        0.0,
        0.0,
        0.0,
        0.0,
        0.0,
        0.0,
        0.0,
        0.0,
        0.0,
        0.0,
        0.0,
        0.0,
        0.0,
        0.0,
        0.0,
        0.0,
        0.0,
        0.0,
        0.0,
        0.0,
        0.0,
        0.0,
        0.0,
        0.0,
        0.0,
        0.0,
        0.0,
        0.0,
        0.0,
        0.0,
        0.0,
        0.0,
        0.0,
        0.0,
        0.0,
        0.0,
        0.0,
        0.0,
        0.0,
        0.0,
        0.0,
        0.0,
        0.0,
        0.0,
        0.0,
        0.0,
        0.0,
        0.0,
        0.0,
        0.0,
        0.0,
        0.0,
        0.0,
        0.0,
        0.0,
        0.0,
        0.0,
        0.0,
        0.0,
        0.0,
        0.0,
        0.0,
        0.0,
        0.0,
        0.0,
        0.0,
        0.0
      ]
    },
    {
      "district": "Pathankot",
      "lat": 32.269,
      "lon": 75.652,
      "mm_72h": 0.0,
      "hourly_mm": [
        0.0,
        0.0,
        0.0,
        0.0,
        0.0,
        0.0,
        0.0,
        0.0,
        0.0,
        0.0,
        0.0,
        0.0,
        0.0,
        0.0,
        0.0,
        0.0,
        0.0,
        0.0,
        0.0,
        0.0,
        0.0,
        0.0,
        0.0,
        0.0,
        0.0,
        0.0,
        0.0,
        0.0,
        0.0,
        0.0,
        0.0,
        0.0,
        0.0,
        0.0,
        0.0,
        0.0,
        0.0,
        0.0,
        0.0,
        0.0,
        0.0,
        0.0,
        0.0,
        0.0,
        0.0,
        0.0,
        0.0,
        0.0,
        0.0,
        0.0,
        0.0,
        0.0,
        0.0,
        0.0,
        0.0,
        0.0,
        0.0,
        0.0,
        0.0,
        0.0,
        0.0,
        0.0,
        0.0,
        0.0,
        0.0,
        0.0,
        0.0,
        0.0,
        0.0,
        0.0,
        0.0,
        0.0
      ]
    }
  ],
  "alerts": [
    {
      "id": "1793244803314036",
      "source": "SACHET",
      "severity": "Severe",
      "event": "Disaster Alert",
      "headline": "Thundering with Lightning and Gusty winds is likely to occur  at isolated places over  Fatehgarh Sahib, Gurdaspur, Jalandhar, Kapurthala, Ludhiana, Sangrur, S.A.S Nagar, SBS Nagar in next 24 hours. If any Emergency call 112 Punjab SDMA.",
      "description": "Thundering with Lightning and Gusty winds is likely to occur  at isolated places over  Fatehgarh Sahib, Gurdaspur, Jalandhar, Kapurthala, Ludhiana, Sangrur, S.A.S Nagar, SBS Nagar in next 24 hours. If any Emergency call 112 Punjab SDMA.",
      "area": "Fatehgarh Sahib, Gurdaspur, Jalandhar, Kapurthala, Ludhiana, S.A.S Nagar, SBS Nagar, Sangrur",
      "effective": "Thu, 29 Oct 2026 03:40:54 GMT",
      "expires": "Thu, 29 Oct 2026 03:40:54 GMT",
      "issued_at": "Thu, 29 Oct 2026 03:40:54 GMT",
      "url": "https://sachet.ndma.gov.in/cap_public_website/FetchXMLFile?identifier=1793244803314036"
    },
    {
      "id": "1793244804006036",
      "source": "SACHET",
      "severity": "Severe",
      "event": "Disaster Alert",
      "headline": "Thunderstorm/Lightning, Hailstorm, Gusty winds(50-60 KMPH)is likely to occur  at isolated places over Hoshiarpur, Pathankot, Patiala, Rupnagar in next 24 hours. If any Emegency call 112 Punjab SDMA.",
      "description": "Thunderstorm/Lightning, Hailstorm, Gusty winds(50-60 KMPH)is likely to occur  at isolated places over Hoshiarpur, Pathankot, Patiala, Rupnagar in next 24 hours. If any Emegency call 112 Punjab SDMA.",
      "area": "Hoshiarpur, Pathankot, Patiala, Rupnagar",
      "effective": "Thu, 29 Oct 2026 03:38:21 GMT",
      "expires": "Thu, 29 Oct 2026 03:38:21 GMT",
      "issued_at": "Thu, 29 Oct 2026 03:38:21 GMT",
      "url": "https://sachet.ndma.gov.in/cap_public_website/FetchXMLFile?identifier=1793244804006036"
    },
    {
      "id": "1792845757084036",
      "source": "SACHET",
      "severity": "Moderate",
      "event": "Disaster Alert",
      "headline": "ਅਗਲੇ 3 ਘੰਟਿਆਂ ਦੌਰਾਨ ਬਰਨਾਲਾ, ਫਰੀਦਕੋਟ, ਮਾਨਸਾ ਅਤੇ ਮੋਗਾ ਵਿੱਚ  ਮੀਂਹ ਅਤੇ ਤੇਜ਼ ਹਵਾਵਾਂ  ਚੱਲਣ ਦੀ ਸੰਭਾਵਨਾ ਹੈ। ਕਿਸੇ ਵੀ ਐਮਰਜੈਂਸੀ ਦੀ ਸਥਿਤੀ ਵਿੱਚ 112 ਤੇ ਕਾਲ ਕਰੋ। ਪੰਜਾਬ SDMA।",
      "description": "ਅਗਲੇ 3 ਘੰਟਿਆਂ ਦੌਰਾਨ ਬਰਨਾਲਾ, ਫਰੀਦਕੋਟ, ਮਾਨਸਾ ਅਤੇ ਮੋਗਾ ਵਿੱਚ  ਮੀਂਹ ਅਤੇ ਤੇਜ਼ ਹਵਾਵਾਂ  ਚੱਲਣ ਦੀ ਸੰਭਾਵਨਾ ਹੈ। ਕਿਸੇ ਵੀ ਐਮਰਜੈਂਸੀ ਦੀ ਸਥਿਤੀ ਵਿੱਚ 112 ਤੇ ਕਾਲ ਕਰੋ। ਪੰਜਾਬ SDMA।",
      "area": "Punjab",
      "effective": "Sat, 24 Oct 2026 12:46:25 GMT",